{
  "schemaVersion": "1.0",
  "domain": {
    "id": "uk-legal",
    "displayName": "UK Legal Customer 360",
    "description": "Customer, legal matter, solicitor, financial transaction, and engagement analytics for a UK legal firm.",
    "culture": "en-GB",
    "currency": "GBP"
  },
  "artifacts": {
    "folder": "data_agent_hackathon",
    "lakehouse": "LegalFirmDemo",
    "optimizedModel": "LegalFirmOptimized",
    "ontology": "LegalFirmOntology",
    "dataAgent": "LegalFirmCustomer360Agent"
  },
  "tables": [
    {
      "sourcePath": "sample-data/uk-legal/base/customers.csv",
      "lakehouseName": "step1_cleaned_customers",
      "modelName": "Customers",
      "description": "One row per legal-firm customer, including type, location, signup date, and current relationship status.",
      "includeInModels": true,
      "columns": [
        { "source": "customer_id", "name": "Customer ID", "type": "int64", "description": "Unique customer identifier.", "hidden": true },
        { "source": "customer_name", "name": "Customer Name", "type": "string", "description": "Customer or organization name." },
        { "source": "customer_type", "name": "Customer Type", "type": "string", "description": "Individual or Corporate customer classification." },
        { "source": "city", "name": "City", "type": "string", "description": "Customer city." },
        { "source": "signup_date", "name": "Signup Date", "type": "date", "description": "Date the customer relationship began.", "formatString": "dd/MM/yyyy" },
        { "source": "phone", "name": "Phone", "type": "string", "description": "Customer contact telephone number." },
        { "source": "email", "name": "Email", "type": "string", "description": "Customer contact email address." },
        { "source": "status", "name": "Customer Status", "type": "string", "description": "Current customer status; Active indicates a current relationship." }
      ]
    },
    {
      "sourcePath": "sample-data/uk-legal/base/cases.csv",
      "lakehouseName": "step1_cleaned_cases",
      "modelName": "Cases",
      "description": "One row per legal case or matter, with customer, assigned solicitor, type, value, start date, and status.",
      "includeInModels": true,
      "columns": [
        { "source": "case_id", "name": "Case ID", "type": "string", "description": "Unique legal case identifier." },
        { "source": "customer_id", "name": "Customer ID", "type": "int64", "description": "Customer associated with the case.", "hidden": true },
        { "source": "solicitor_name", "name": "Solicitor Name", "type": "string", "description": "Solicitor assigned to the case.", "hidden": true },
        { "source": "case_type", "name": "Case Type", "type": "string", "description": "Legal practice area or matter type." },
        { "source": "case_value_gbp", "name": "Case Value", "type": "double", "description": "Financial value of the case in GBP.", "formatString": "GBP #,##0.00" },
        { "source": "start_date", "name": "Start Date", "type": "date", "description": "Date the case started.", "formatString": "dd/MM/yyyy" },
        { "source": "case_status", "name": "Case Status", "type": "string", "description": "Current legal case status." }
      ]
    },
    {
      "sourcePath": "sample-data/uk-legal/base/solicitors.csv",
      "lakehouseName": "step1_cleaned_solicitors",
      "modelName": "Solicitors",
      "description": "One row per solicitor, including specialization, hire date, hourly rate, office, and employment status.",
      "includeInModels": true,
      "columns": [
        { "source": "solicitor_id", "name": "Solicitor ID", "type": "int64", "description": "Unique solicitor identifier.", "hidden": true },
        { "source": "solicitor_name", "name": "Solicitor Name", "type": "string", "description": "Solicitor full name." },
        { "source": "specialization", "name": "Specialization", "type": "string", "description": "Primary legal specialization." },
        { "source": "hire_date", "name": "Hire Date", "type": "date", "description": "Date the solicitor joined the firm.", "formatString": "dd/MM/yyyy" },
        { "source": "hourly_rate_gbp", "name": "Hourly Rate", "type": "double", "description": "Standard hourly billing rate in GBP.", "formatString": "GBP #,##0.00" },
        { "source": "office_location", "name": "Office Location", "type": "string", "description": "Solicitor office location." },
        { "source": "status", "name": "Solicitor Status", "type": "string", "description": "Current employment status." }
      ]
    },
    {
      "sourcePath": "sample-data/uk-legal/base/transactions.csv",
      "lakehouseName": "step1_cleaned_transactions",
      "modelName": "Transactions",
      "description": "One row per case-related invoice, payment, timesheet, or expense transaction.",
      "includeInModels": true,
      "columns": [
        { "source": "transaction_id", "name": "Transaction ID", "type": "string", "description": "Unique transaction identifier.", "hidden": true },
        { "source": "case_id", "name": "Case ID", "type": "string", "description": "Case associated with the transaction.", "hidden": true },
        { "source": "transaction_type", "name": "Transaction Type", "type": "string", "description": "Invoice, Payment, Timesheet, or Expense." },
        { "source": "transaction_date", "name": "Transaction Date", "type": "date", "description": "Transaction posting date.", "formatString": "dd/MM/yyyy" },
        { "source": "amount_gbp", "name": "Transaction Amount", "type": "double", "description": "Transaction amount in GBP.", "formatString": "GBP #,##0.00" },
        { "source": "hours_worked", "name": "Hours Worked", "type": "double", "description": "Hours recorded for Timesheet transactions.", "formatString": "0.00" },
        { "source": "payment_status", "name": "Payment Status", "type": "string", "description": "Payment state for applicable transactions." }
      ]
    },
    {
      "sourcePath": "sample-data/uk-legal/base/interactions.csv",
      "lakehouseName": "step1_cleaned_interactions",
      "modelName": "Interactions",
      "description": "One row per customer interaction, including channel, date, duration, solicitor, and notes.",
      "includeInModels": true,
      "columns": [
        { "source": "interaction_id", "name": "Interaction ID", "type": "string", "description": "Unique interaction identifier.", "hidden": true },
        { "source": "customer_id", "name": "Customer ID", "type": "int64", "description": "Customer associated with the interaction.", "hidden": true },
        { "source": "solicitor_name", "name": "Solicitor Name", "type": "string", "description": "Solicitor involved in the interaction." },
        { "source": "interaction_type", "name": "Interaction Type", "type": "string", "description": "Interaction channel such as meeting, call, or email." },
        { "source": "interaction_date", "name": "Interaction Date", "type": "date", "description": "Date of the interaction.", "formatString": "dd/MM/yyyy" },
        { "source": "duration_minutes", "name": "Duration Minutes", "type": "int64", "description": "Interaction duration in minutes.", "formatString": "0" },
        { "source": "notes", "name": "Notes", "type": "string", "description": "Short interaction notes." }
      ]
    },
    {
      "sourcePath": "sample-data/uk-legal/derived-routing/client_engagement_summary.csv",
      "lakehouseName": "step6_client_engagement_summary",
      "modelName": "Client Engagement Summary",
      "description": "Customer-level engagement metrics for multi-source routing demonstrations.",
      "includeInModels": false,
      "columns": [
        { "source": "customer_id", "name": "Customer ID", "type": "int64" },
        { "source": "customer_name", "name": "Customer Name", "type": "string" },
        { "source": "customer_type", "name": "Customer Type", "type": "string" },
        { "source": "customer_status", "name": "Customer Status", "type": "string" },
        { "source": "total_interactions", "name": "Total Interactions", "type": "int64" },
        { "source": "last_interaction_date", "name": "Last Interaction Date", "type": "date" },
        { "source": "avg_interaction_duration_minutes", "name": "Average Interaction Duration Minutes", "type": "double" },
        { "source": "dominant_interaction_type", "name": "Dominant Interaction Type", "type": "string" },
        { "source": "engagement_segment", "name": "Engagement Segment", "type": "string" }
      ]
    },
    {
      "sourcePath": "sample-data/uk-legal/derived-routing/case_finance_insights.csv",
      "lakehouseName": "step6_case_finance_insights",
      "modelName": "Case Finance Insights",
      "description": "Case-level financial outcome metrics for cross-domain routing demonstrations.",
      "includeInModels": false,
      "columns": [
        { "source": "case_id", "name": "Case ID", "type": "string" },
        { "source": "customer_id", "name": "Customer ID", "type": "int64" },
        { "source": "solicitor_name", "name": "Solicitor Name", "type": "string" },
        { "source": "case_type", "name": "Case Type", "type": "string" },
        { "source": "case_status", "name": "Case Status", "type": "string" },
        { "source": "case_value_gbp", "name": "Case Value", "type": "double" },
        { "source": "total_timesheet_amount_gbp", "name": "Total Timesheet Amount", "type": "double" },
        { "source": "total_expense_amount_gbp", "name": "Total Expense Amount", "type": "double" },
        { "source": "total_invoice_amount_gbp", "name": "Total Invoice Amount", "type": "double" },
        { "source": "total_payment_amount_gbp", "name": "Total Payment Amount", "type": "double" },
        { "source": "total_hours_billed", "name": "Total Hours Billed", "type": "double" },
        { "source": "outstanding_amount_gbp", "name": "Outstanding Amount", "type": "double" },